,Job Title,Company Name: ,Location,Country,Employment Type,Experience Needed,Description,Requirments
17,Data Scientist “Mathematics/Physics,Dafa,Cairo, Egypt,['Full Time'],Experienced,"['We are looking for someone with 7-10 years of experience mining/manipulating data sets and building statistical models, has a Master’s or PHD in Physics/Statistics, Mathematics, Computer Science or another quantitative field', 'Job Description', 'Work with stakeholders throughout the organization to identify opportunities for leveraging company data to drive business solutions', 'Mine and analyze data from company databases to drive optimization and improvement of product development, marketing techniques and business strategies', 'Assess the effectiveness and accuracy of new data sources and data gathering techniques', 'Develop custom data models and algorithms to apply to data sets', 'Use predictive modeling to increase and optimize customer experiences, revenue generation, ad targeting and other business outcomes', 'Develop company A/B testing framework and test model quality', 'Coordinate with different functional teams to implement models and monitor outcomes', 'Develop processes and tools to monitor and analyze model performance and data accuracy']","['Strong problem solving skills with an emphasis on product development', 'Experience using statistical computer languages (R, Python, SLQ, etc.) to manipulate data and draw insights from large data sets', 'Knowledge of advanced statistical techniques and concepts (regression, properties of distributions, statistical tests and proper usage, etc', 'Experience working with and creating data architectures', 'Coding knowledge and experience with several languages: C, C++, Java', 'JavaScript, etc', 'Knowledge and experience in statistical and data mining techniques: GLM/Regression, Random Forest, Boosting, Trees, text mining, social network analysis, etc', 'Experience querying databases and using statistical computer languages: R, Python, SLQ, etc', 'Experience using web services: Redshift, S3, Spark, DigitalOcean, etc', 'Experience creating and using advanced machine learning algorithms and statistics: regression, simulation, scenario analysis, modeling, clustering, decision trees, neural networks, etc', 'Experience analyzing data from 3rd party providers: Google Analytics, Site Catalyst, Coremetrics, Adwords, Crimson Hexagon, Facebook Insights, etc', 'Experience with distributed data/computing tools: Map/Reduce, Hadoop, Hive, Spark, Gurobi, MySQL, etc', 'Experience visualizing/presenting data for stakeholders using: Periscope, Business Objects, D3, ggplot, etc']"
18,Senior C++ Software Developer,Luxoft (A DXC Technology Company,Cairo, Egypt,"['Full Time', 'Work From Home']",Experienced,"['Luxoft is one of the major software services companies world-wide', 'We deliver professional software services in multiple business verticals such as finance, automotive, and digital transformation', ""Supporting large vehicle manufacturers in the area of development, production and aftersales is Luxoft's ambition"", 'The software inside a vehicle was traditionally expected to be a very controlled and self-contained environment', 'Equipping cars with perception and machine intelligence changes a lot in the overall picture of the vehicle manufacturer', ""Luxoft's goal is to empower our customers, with deep domain knowledge and smart solutions, to develop cars of the future. Great mechanical engineering is not the only criteria anymore for delivering the best cars in the world"", 'Using state of the art software technologies are key to provide the requested user experience', 'For the development of the next generation of ADAS (Advanced Driver Assistance Systems) and HAD\xa0(Highly Automated Driving) functions for a major German OEM, we are looking for talented C++ Developers (m/f/d', 'Join our team of enthusiastic and experienced software developers and develop software for an entire driver assistance area of future vehicles of a renowned German automotive manufacturer', 'Develop challenging features that will be used on a daily basis by millions of drivers once the next generation of vehicles hits the roads starting']","['Academic degree in computer science, mechatronics, electronic engineering, telecommunication engineering or similar qualification, PhD welcome', 'Strong OOP and C++background, also in new standards', 'Strong software debugging skills, understanding of performance optimization', 'Very good understanding of the software development process, preferably in the automotive area', 'You are hardworking and have team spirit', 'Strong communication skills in English']"
19,Data Engineer,Cilantro,"Maadi, Cairo", Egypt,['Full Time'],Entry Level,"['ETL maintenance for data freshness and maximum warehouse uptime', 'Integrate new data sources to ETL', 'Build monitoring dashboards for data delivery and quality', 'Data platform infrastructure maintenance and expansion when necessary', 'Adapting and evolving the data platform based on business requirements', 'Support in analytical dashboards creation and interfaces for stakeholders', 'Support in analytical tools development and maintenance']","['Core understanding of OOP, and preferred proficiency in Python', 'Fair knowledge of SQL', 'Basic understanding of database systems', 'Fair knowledge of cloud providers, preferably GCP', 'Basic understanding of cloud data warehouses, preferably Big Query', 'Experience using Pandas', 'Experience with data workflow orchestration (Airflow', 'Nice to have: Machine learning and predictive analytics algorithms, experience using SQLAlchemy and Flask']"
20,Pre Sales Engineer,BBI-Consultancy,"Nasr City, Cairo", Egypt,['Full Time'],Experienced,"['Technical Consultancy', 'New Technology Exploration, whether an entirely new product or new modules of already existing products', 'Conduct Online Webinars', 'Develop Proof of Concepts (PoCs) for customers', 'Develop and present Demos Solution Offerings', 'Participate in creating BBI’s solution offerings', 'Research different sectors’ best practices and latest trends', 'Work with different BBI teams to combine the sectors’ knowledge with the technology knowledge to create solutions offerings', 'Technical Partner Engagement', 'Handle Knowledge Transfer between BBI’s partners & BBI teams', 'Discuss and learn Architecture Guidelines & Licensing Guides from BBI’s Partners', 'Collaborate with partners on replying to customers’ Compliance Matrices', 'Design & Develop Add-ons on partner’s products', 'Create Sales Toolkit', 'Create Ready-Made Demos for other commercial team members to use, including writing the scenario, developing the demo and creating a demo script, the ready-made demos should be categorized as follows']",['Technical Hands-on experience of more than 3 years in one or more of the following areas']
21,Senior Full Stack Developer,Fotopia,"Heliopolis, Cairo", Egypt,['Full Time'],Experienced,"['We are growing and if you believe you have the right startup mindset for an aggressive growth roadmap, check the job description below and apply', 'We are looking for a Senior Full Stack Engineer who has working experience with modern and cutting-edge technologies including AI and Machine Learning. We would like you to lead and coach a team of highly skilled developers in building state of the art technologies and software products, using tools such as Angular, React, JavaScript, Python, MongoDB, Docker, .NET framework as detailed below', 'Solid knowledge and experience in React, TypeScript, HTML5, CSS3, Bootstrap', 'Solid experience with both RDBMS and NoSQL databases (MS SQL Server & MongoDB', 'Solid experience with C#.NET, ASP.NET MVC, .NET core & Microsoft Development Tools', 'Solid Experience in object-oriented programming & software design patterns', 'Fair knowledge of Phyton, AI, machine learning concepts is plus', 'Fair experience in Microsoft Azure, at least App Services and Azure Storage is plus', 'Fair knowledge of Azure DevOps, deploying and automating CI/CD pipelines across multiple environments is plus', 'Good knowledge of Docker or Kubernetes is a plus']","['Bachelor’s degree in computer science or computer engineering', 'Minimum 5 Years of proven work experience, preferably within a technology organization as both a hands-on architect and/or a software engineer', 'Excellent command of English language', 'Have a keen eye for quality and details', 'Very good analytical and creative problem-solving skills', 'What we offer', 'A startup environment to grow where the sky is the limit', 'Top of the market salaries and financial packages', 'Stock options based on the position applied to and proven experience', 'Medical and social insurance']"
22,Application Support Engineer,Caelum Egypt,"Dokki, Giza", Egypt,['Full Time'],Entry Level,"['Provide 1st & eventually 2nd level (after good training on company products) support for production issues across multiple applications, including problem identification, definition and implementation of short-term work around and coordination of long term software solution with business analysis and development team', 'Setup, configure and maintain monitoring for the deployed systems', 'Maintain the company knowledge base related to deployment of new applications and resolutions for known issues', 'Write internal administration guides for the applications and trains the staff in case of new deployment processes are introduced', 'Install and configure clients’ environments on request - onsite or offsite', 'Perform advances investigation of issues including network troubleshooting', 'Diagnose and resolve day-to-day live system issues in timely manner based on their severity', 'Clear understanding of software development lifecycle methodologies and documentation standards', 'Maintain ongoing communication with end-users, business analysts, QA team, and development team on reported issues', 'Coordinate, Review and respond to system audit alerts in a timely manner', 'Ability to write, modify, and execute SQL queries for SQL database', ""Configuration of local machines to clone client's production environment for troubleshooting reported issues"", 'Effectively record and monitor progress of all issues raised, providing feedback to the business users as required', 'Liaise with other support/development teams to resolve cross system issues', 'Maintain application support documentation', 'Test configuration changes in a test environment prior to pushing into production', 'Design and support application reports', 'Maintain confidentiality with regard to the information being processed, stored or accessed', 'Read and recognize the function of SQL queries to perform troubleshooting related to application changes and releases']","['Bachelor degree in Software/Computer Engineering, Computer Sciences, or related field', 'Minimum of 2 years’ experience in a software development context with minimum 2 year in a support role', 'Fluent in English is must', 'Experience in supporting and maintaining applications on desktop, web and database platforms', 'Solid working knowledge in SQL database is a must', 'Fluent English is a MUST', 'Solid experience in CRM systems (Microsoft Dynamics CRM is a plus', 'Solid experience in cloud computing platform (Microsoft Azure is a plus', 'Business Intelligence knowledge is a plus', 'Working experience in .NET framework is a plus', 'Ability to read and understand job-related materials such as instructions, specifications, references and manuals', 'Ability to work with demanding users in a fast paced environment', 'Excellent organizational, analytical, as well as oral and written communication skills', 'Excellent interpersonal and communication skills (oral and written', 'Strong critical thinking and analysis, meeting facilitation, verbal and written communications, and interpersonal skills', 'The ability to explain complicated concepts in a simple manner', 'Proven documentation skills with consistent accuracy of details', 'Strong understanding of change control processes, time management and attention to detail', 'Ability to manage time and work well under pressure', 'Flexibility to handle multiple work streams at any time', 'Ability to investigate, analyze information and to draw conclusions in order to troubleshoot issues', 'Ability to learn and support new applications', 'Ability to work independently or as part of a team', 'Proven ability to understand a customer’s business environment and processes', 'Ability to travel abroad when needed']"
23,Odoo Developer & Pre-Sales Specialist,Elitbuzz,"Maadi, Cairo", Egypt,['Full Time'],Experienced,"['Implement Odoo ERP for different client verticals', 'Design/Configure/Customize/Integrate/Test/Deploy Odoo System based on client requirements & project scope by meeting the project deadlines', 'Design & develop new modules, workflows, reports, APIs etc', 'Coordination with Project Manager/Business Analyst/Junior developers/client and ensure the successful implementation of all client projects on time', 'Takes higher ownership for tasks and duties assigned', 'Guide & mentor Junior Developers whenever required. Assign project tasks & track activities of team members', 'Build prototypes at scoping stage of projects to support Presales team', 'Setup, maintain & monitor Odoo servers -Cloud & On-premise', 'Manage source control such as GITLAB', 'Odoo database & modules migration', 'Integrate Odoo with other software applications', 'Responsible to deliver multiple projects parallelly', 'Support & execute project tasks with onsite/offshore team members', 'Post implementation support']","['Bachelor/Master Degree in computer science or engineering', 'Minimum 5 years of recent Odoo development & implementation experience', 'Ability to work effectively as a team member, demonstrating excellent organizational skills and initiative and flexibility', 'Must have sound knowledge of Odoo MVC architecture', 'Must have strong technical & functional knowledge of Odoo core modules such as Sales, Purchase, Inventory, Accounting, POS, Ecommerce, Project, Manufacturing, Qweb Reporting, etc', 'Knowledge of odoo.sh will be an added advantage', 'Sound knowledge of version control system tools like git and its tools such as Jira, GitHub, Bitbucket, Atlassian', 'Skills to research, learn, troubleshoot, debug, and support complex Odoo customizations', 'Experience in writing techno functional documentation', 'Hands-on experience in configuring & installing POS hardware items, Biometric attendance machines etc. with Odoo System', 'Strong in Python programming, PostgreSQL, Java Script & Object Oriented Design and Programming', 'Strong written & verbal communication skills in English language', 'A comfort level with both giving and receiving respectful constructive critical feedback', 'Good team player & ability to work under pressure', 'Strong sense of commitment, responsibility and ownership']"
24,Production Engineer - Rodniture Furniture,Metal & Steel Innovation,Cairo, Egypt,['Full Time'],Experienced,"['The applicant must have meaningful experience in furniture design/engineering, high attention to detail, and strong leadership and communication skills. Sketching/drafting skills and CAD proficiency are a plus', 'Preference is given to candidates with business/entrepreneurial experience', 'Review order acknowledgments and monitor production progress; report to sales reps in weekly PM meetings', 'Review technical drawings for accuracy and get factory and client’s approval of designs', 'Oversee site measurements and installation of custom furniture as needed', 'Conduct physical inspections of factories and furniture whenever possible', 'Coordinate freight forwarders, warehouses, and local delivery companies to ensure orders are handled properly and delivered on time', 'Coordinate service providers to correct mistakes/damages as quickly as possible', 'Process claims/chargebacks against vendors as appropriate', 'Initiate programs and operate CNC for best quality output', 'Read and interpret plans, sketches, and shop drawings', 'Work with designers and management to achieve customer satisfaction', 'Maintain a high level of production while maintaining quality', 'Responding to quick turn-around orders', 'Manage the overall daily production activities including (production planning, scheduling, quality assurance, budgeting, etc', 'Assess projects and resources requirements and demands']","['Bachelor degree from a reputable university', 'Experience in Furniture Production is a Must', 'Excellent computer skills', 'Minimum 2-4 years of experience in furniture manufacturing plants', 'Good communication skills', 'Able to work under pressure', 'At least 2 years of work experience in operating CNC machines', 'Ability to work under limited supervision using standard practices', 'Experience in Quality Control']"
25,Data Labeler,Micro Engineering,"Heliopolis, Cairo", Egypt,"['Full Time', 'Shift Based']",Entry Level,"['Label machine learning data from clients', 'Complete tasks in a timely manner, meeting SLA deadlines', 'Do post-process audits and write error reports on data and tasks', 'Work in-sync with Team Leads to meet weekly goals']","['Detail oriented and can follow complex instructions', 'Ability to work full-time hours (8-hour workdays', 'Ability to work independently, cooperatively, and collaboratively as a team member', 'Possession of good communication and English language skills', 'Strong sense of ownership, urgency, and drive', 'Ability to handle ambiguity and changing priorities']"
26,Sales Engineer,IBIS SUPPLIES,"New Cairo, Cairo", Egypt,['Full Time'],Experienced,"['Creating new accounts of customers, maintain and develop', 'Achieving ethically and professionally the targets and hit rate of pipeline', 'Seeking for available opportunities to expand the pipeline, and deep follow up for increasing hit rate and meet the budget']","['Preferred Airports equipment’s and systems experience', 'High sales skills and negotiation, High ability for learning, customer oriented', 'Joining in implementing market intelligence for the scope of the company', 'Close follow up for the market situation and changes', 'Presentable, smart, active, good command in English language']"
27,Artificial Intelligence (AI) Engineer,Confidential,Riyadh, Saudi Arabia,['Full Time'],Experienced,"['Develops required machine learning models or prototype applications, applying formulated AI recipes and verifying the problem/solution fit', 'Understands the challenges in medical imaging and using state of the art solutions in AI and DL', 'Participates in building new experiences, improves existing products, ensures quality assurance test designs and contributes to test systems architecture discussions', 'Works alongside leading innovators in the field of deep learning and health care, plays a critical role in algorithm development', 'Analyzes and evaluates data and builds deep networks to detect or predict features, while effectively balancing quality, availability, timeliness and cost factors']","['BA/BS degree in computer science or related discipline is required, MS degree is preferred', 'Good command of the English language required (spoken and written']"
28,Senior Python / Django Developer,RDI,"Dokki, Giza", Egypt,['Full Time'],Experienced,"['Participating in architectural, design and product discussions', 'Working closely with UX and Front-end Developers', 'Develop cloud-based Python Django software products', 'Designing and creating RESTful APIs for internal and partner consumption', 'Writing reusable, testable, and efficient code']","['years of on-the-job software engineering experience', 'Solid database skills in a relational database (i.e. PostgresSQL, MySQL, etc', 'Knowledge of how to build and use RESTful APIs', 'Experience with modern JavaScript frameworks such as React', 'Proficiency using industry standard 3rd party tools such as Docker', 'Strong knowledge of version control (git', 'Experience deploying Python applications into production', 'Understanding of the threading limitations of Python, and multi-process architecture', 'Knowledge of user authentication and authorization between multiple systems, servers, and environments', 'Strong unit test and debugging skills', 'Google Cloud Platform (GCP) knowledge is a plus', 'Experience working in Linux environments and basic shell is a plus']"
29,Business Analyst,Streams,"Dokki, Giza", Egypt,['Full Time'],Experienced,"['Prepares detailed analysis documents with defined and appropriate techniques for functional and non-functional requirements', 'Develops innovative solutions for customers’ requirements and participates in the lifecycle development process of product definition through design, development, test, release, and maintenance', 'Works with the technology and business groups to define project specifications', 'Develops tools and frameworks and enhances the efficiency of the development, test, and release processes', 'Supports developers and QC engineers by clarifying requirements or business concerns generated anytime within the lifecycle development process', 'Communicates effectively with product owners’ insights and supports cross-functional team members and management', 'Delivers daily status reports to the department manager', 'Collaborates and communicates proactively with clients and internal teams to analyze functional requirements and the appropriate project scope according to business needs', 'Translates complex business, functional and technical requirements into detailed work tasks and prepares project scope statements', 'Develops requirement specifications according to standard templates', 'Reviews the documents with the direct manager and the technical team, before finalizing and versioning it']","['Bachelor’s Degree in Computer Science', 'years of proven experience', 'Knowledge of software technology, computer programming experience, and broad business knowledge', 'Proficient in Microsoft Office programs (Access, Excel, Project, PowerPoint, etc.) and Software Design Tools', 'Ability to elicit and document functional requirements, write specifications, use cases, and design user interface requirements for applications', 'Positive attitude even under high pressure and stressful situations', 'Strong problem solving and analytical skills', 'Advanced organization skills to manage teams, resources, processes, and time to achieve a target result within the stipulated timeframe', 'Strong oral and written communication skills', 'Knowledge of machine learning / AI is a plus']"
30,Microsoft CRM Developer,Perfect Presentation,"th of October, Giza", Egypt,['Full Time'],Experienced,"['Writing and documenting the technical specifications and requirements for the planned work from the application consultant', 'Create and maintain a scheme to support system requirements and adherence to Al Majed for Oud standards, policies, and procedures', 'Develop software and identify and resolve website errors on Microsoft Dynamics to improve user experience · Building plans for integrating Dynamics with systems and external resources using SOAP, XML, and REST APIs along with various integration patterns', 'Configure and customize Microsoft Dynamics 365 applications using native and custom forms, entities, plug-ins (JavaScript, C#), Microsoft Flows, X++, .NET, PowerBI, PowerApps, Azure IoT Suite, AppSource, third-party applications, and Azure Machine Learning, SSRS Reports', 'Design technical solutions that support the exchange of channels that serve as the basis for the introduction of routed data throughout the application', 'Ensure that all solutions are lightweight scalable, completely secure and designed with an appropriate level of quality', 'Plan and implement system developments, and provide updates on a regular basis to internal and external clients', 'Follow all relevant policies, processes, standard operating procedures and instructions and ensure work is carried out in a controlled and consistent manner', 'Contribute to the identification of opportunities for continuous improvement of systems, processes and practices, taking into account leading practices, improvement of business processes, cost reduction and productivity improvement', 'Promote the implementation and adherence to relevant policies, processes and operating procedures to others']","['Minimum of 3 years of experience in systems administration and development', 'Knowledge of managing and configuring Microsoft Dynamics systems', ""Bachelor's degree or diploma in Computer Science, Computer Engineering or similar field""]"
